{"audit_id":"6396de29749f52ea9cd4b95b03f75bc35894c9dc1d520809c49633b61492d46c","audit_scope":["scope","architecture","correctness","security","data","tests","documentation","dependencies","compatibility","public_contracts","migrations","unrequested_changes","completion_claims","maintainability"],"authority_statement":"Crew Chief is advisory; Maverick retains final authority.","blocked_reasons":[],"canary":"CANOPY-7C2F-ATLAS","envelope_id":"09eb6eed68d95f32e530561cf8604f8c1e297e4ad7cb16d04ae0b7003e8df12a","findings":[],"generated_at":"2026-08-10T20:00:00Z","reviewer_context":{"fresh_session":true,"implementation_conversation_inherited":false,"live_network_tools_enabled":false,"read_only":true},"role":"crew_chief","schema_version":"1.0","validation_evidence":["diff:unstaged.diff/diffs/unstaged.diff","evidence:001/evidence/validation-evidence.json","evidence:002/evidence/ledger-transition-evidence.md","evidence:003/evidence/sensitive-content-scan.json","evidence:004/evidence/crew-chief-report.json","evidence:005/evidence/crew-chief-reconciliation.json","evidence:006/evidence/crew-chief-run-record.json"],"verdict":"PASS"}
