{"audit_id":"05f2d9fd8bdd1e480d490eea6587ca3daf2ab7334b67b44f1733a2d88fa1a60b","audit_scope":["scope","architecture","correctness","security","data","tests","documentation","dependencies","compatibility","public_contracts","migrations","unrequested_changes","completion_claims","maintainability"],"authority_statement":"Crew Chief is advisory; Maverick retains final authority.","blocked_reasons":[],"canary":"CANOPY-7C2F-ATLAS","envelope_id":"fccfeff8387a1e9f053a8fadc68ae625f4cce6789db4b12a0395ec45c2b37795","findings":[{"action":"Replace in-place shared-to-exclusive lock conversion with an exclusive connection acquired from the outset, or make failed conversion explicitly reacquire and verify the prior shared lock before returning control. Add a multiprocess regression where two shared connections attempt maintenance concurrently and verify neither continues without a lock.","action_kind":"required","blocking":true,"blocking_rationale":"This medium-severity concurrency defect is blocking because maintenance and migration safety depend on continuous exclusive ownership; a failed non-atomic flock conversion can leave an ordinary connection continuing without its recorded shared lock.","category":"correctness","evidence":[{"detail":"Maintenance upgrades the lock attached to an already-open shared connection and restores the previous mode only after successful context entry.","kind":"source","line_end":157,"line_start":140,"path":"src/wingman/core/ledger/database.py","state":"worktree"},{"detail":"The conversion repeatedly invokes non-blocking flock conversion but updates the recorded mode only after success; timeout handling does not explicitly reacquire or verify the prior lock.","kind":"source","line_end":174,"line_start":147,"path":"src/wingman/core/ledger/locking.py","state":"worktree"}],"finding_id":"CC-0001","severity":"medium","why_it_matters":"BSD flock upgrades are not guaranteed to preserve the existing shared lock while attempting conversion. If two readers upgrade concurrently or an upgrade times out, the connection may remain open while its object still reports shared mode even though kernel lock ownership was lost. That breaks the full-connection locking invariant and can admit writes or maintenance during migration-sensitive work."}],"generated_at":"2026-08-10T19:23:18Z","reviewer_context":{"fresh_session":true,"implementation_conversation_inherited":false,"live_network_tools_enabled":false,"read_only":true},"role":"crew_chief","schema_version":"1.0","validation_evidence":["evidence:001/evidence/validation-evidence.json","evidence:002/evidence/ledger-transition-evidence.md","evidence:003/evidence/sensitive-content-scan.json","diff:unstaged.diff/diffs/unstaged.diff"],"verdict":"FAIL"}
