{"audit_id":"c4785a03502688f2562d9a798010acab23291bfa4cd7fb79aa5006a96dd394ed","audit_scope":["scope","correctness","tests","documentation","unrequested_changes","completion_claims","maintainability"],"authority_statement":"Crew Chief is advisory; Maverick retains final authority.","blocked_reasons":[],"canary":"CANOPY-7C2F-ATLAS","envelope_id":"533099626cb4df5fb549649c99a0d9b1a6671f50b5541b92e1f56b7deef6e925","findings":[{"action":"Restore calculate_total to addition and rerun the committed calculator test successfully before approval or mission completion.","action_kind":"required","blocking":true,"blocking_rationale":"The reviewed head directly violates an explicit acceptance criterion and the bound validation evidence records a failing required test.","category":"correctness","evidence":[{"detail":"calculate_total returns left - right despite its sum contract.","kind":"source","line_end":6,"line_start":6,"path":"src/calculator.py","state":"head"},{"artifact":"evidence:001","kind":"artifact","reference":"evidence/artifact-001.log"}],"finding_id":"CC-0001","severity":"high","why_it_matters":"For inputs 2 and 3 the implementation returns -1 instead of 5, so the arithmetic helper is incorrect and the mission acceptance criteria are unmet."}],"generated_at":"2026-08-10T19:00:00Z","reviewer_context":{"fresh_session":true,"implementation_conversation_inherited":false,"live_network_tools_enabled":false,"read_only":true},"role":"crew_chief","schema_version":"1.0","validation_evidence":["diff:committed.diff/diffs/committed.diff","evidence:001/evidence/artifact-001.log"],"verdict":"FAIL"}
