{"audit_id":"f3283981a7cf5e87982d4e3a7472835e47bd9a7b420c642bc3c165e95857d1e7","audit_scope":["scope","correctness","tests","documentation","unrequested_changes","completion_claims","maintainability"],"authority_statement":"Crew Chief is advisory; Maverick retains final authority.","blocked_reasons":[],"canary":"CANOPY-7C2F-ATLAS","envelope_id":"1ee8068de8a2c596b48b32dd398829da3debc0391206b7cadeef446547a9512e","findings":[],"generated_at":"2026-08-10T19:00:00Z","reviewer_context":{"fresh_session":true,"implementation_conversation_inherited":false,"live_network_tools_enabled":false,"read_only":true},"role":"crew_chief","schema_version":"1.0","validation_evidence":["diff:committed.diff / diffs/committed.diff","evidence:001 / evidence/artifact-001.log"],"verdict":"PASS"}
